drdookie;Yeah breastfeeding burns 450-700 calories a day;https://oauth.reddit.com/r/todayilearned/comments/y382vf/til_that_pope_innocent_viii_was_breastfed_while.json;3
caretodeal;That doesn't pass the bullshit test.;https://oauth.reddit.com/r/todayilearned/comments/y382vf/til_that_pope_innocent_viii_was_breastfed_while.json;2
mediumokra;Suddenly.... I'm feeling very sick now;https://oauth.reddit.com/r/todayilearned/comments/y382vf/til_that_pope_innocent_viii_was_breastfed_while.json;1
jaavaaguru;What makes human titty juice worse than cow titty juice? At least sticking with your own species is natural.;https://oauth.reddit.com/r/todayilearned/comments/y382vf/til_that_pope_innocent_viii_was_breastfed_while.json;2
BootyThunder;"Just slurp some breast milk, that outta fix you right up! 

I tried my friend’s once, not straight from the tap though. No complaints!";https://oauth.reddit.com/r/todayilearned/comments/y382vf/til_that_pope_innocent_viii_was_breastfed_while.json;2
doomgiver98;Technically, isn't all milk breast milk?;https://oauth.reddit.com/r/todayilearned/comments/y382vf/til_that_pope_innocent_viii_was_breastfed_while.json;3
total_insertion;Not coconut milk.;https://oauth.reddit.com/r/todayilearned/comments/y382vf/til_that_pope_innocent_viii_was_breastfed_while.json;4
fridayfisherman;*shrugs* close enough;https://oauth.reddit.com/r/todayilearned/comments/y382vf/til_that_pope_innocent_viii_was_breastfed_while.json;5
Tabularasa8;"&gt; I tried my friend’s once, not straight from the tap though. No complaints! 

Why....And how'd it taste?";https://oauth.reddit.com/r/todayilearned/comments/y382vf/til_that_pope_innocent_viii_was_breastfed_while.json;3
LillyLallyLu;It tastes like cereal milk or melted vanilla milkshake.;https://oauth.reddit.com/r/todayilearned/comments/y382vf/til_that_pope_innocent_viii_was_breastfed_while.json;4
d_bone36;That’s a good way to put it, it’s like a sweeter milk;https://oauth.reddit.com/r/todayilearned/comments/y382vf/til_that_pope_innocent_viii_was_breastfed_while.json;5
BlueCircleMaster;Excellent for Coffee.;https://oauth.reddit.com/r/todayilearned/comments/y382vf/til_that_pope_innocent_viii_was_breastfed_while.json;6
DessaChan;It tastes slightly of whatever the woman ate but sweet;https://oauth.reddit.com/r/todayilearned/comments/y382vf/til_that_pope_innocent_viii_was_breastfed_while.json;4
sidewalkoyster;My friend made a White Russian with some;https://oauth.reddit.com/r/todayilearned/comments/y382vf/til_that_pope_innocent_viii_was_breastfed_while.json;3
1inthepink;This is the way.;https://oauth.reddit.com/r/todayilearned/comments/y382vf/til_that_pope_innocent_viii_was_breastfed_while.json;4
MedicalJargon-itis;We use protein shakes now like Boost or Ensure.;https://oauth.reddit.com/r/todayilearned/comments/y382vf/til_that_pope_innocent_viii_was_breastfed_while.json;1
SunglassesDan;Calling them protein shakes is a little generous. They have about half the protein to calorie ratio of actual protein shakes and have a ton of sugar.;https://oauth.reddit.com/r/todayilearned/comments/y382vf/til_that_pope_innocent_viii_was_breastfed_while.json;2
StrongArgument;I mean, they’re meal replacements. They’re actually balanced to the nutrients you need to replace eating, and they’re highly digestible.;https://oauth.reddit.com/r/todayilearned/comments/y382vf/til_that_pope_innocent_viii_was_breastfed_while.json;3
WhittlingDan;I practically live on them. I have GI problems?;https://oauth.reddit.com/r/todayilearned/comments/y382vf/til_that_pope_innocent_viii_was_breastfed_while.json;4
PeachSnappleOhYeah;"&gt;	By July 1492, Innocent had become very skinny. To Filippo Valori,[19] he had become 'an inert mass of flesh, incapable of assimiliating any nourishment but a few drops of milk from a young woman's breast'.[20] He then developed a fever and died.

reads a lot different than this title did.";https://oauth.reddit.com/r/todayilearned/comments/y382vf/til_that_pope_innocent_viii_was_breastfed_while.json;0
Real_Jackraps;Titles reading like he slurping some long stream of unending milk but was still wasting away.;https://oauth.reddit.com/r/todayilearned/comments/y382vf/til_that_pope_innocent_viii_was_breastfed_while.json;1
54B3R_;Why does it have to be a young woman?;https://oauth.reddit.com/r/todayilearned/comments/y382vf/til_that_pope_innocent_viii_was_breastfed_while.json;1
trimtab28;Wet nurse has to have been pregnant recently. Young is relative, granted, but given typical age of marriage, maternal mortality, and overall life expectancy in the era- your typical child rearing woman in such a position likely would've been early to mid 20s;https://oauth.reddit.com/r/todayilearned/comments/y382vf/til_that_pope_innocent_viii_was_breastfed_while.json;2
WhittlingDan;I'm pretty sure that as long as they keep something suckling on their tits that a woman can produce milk indefinitely. Some producing a lot more than others and those were probably the more successful wet nurses.;https://oauth.reddit.com/r/todayilearned/comments/y382vf/til_that_pope_innocent_viii_was_breastfed_while.json;3
RevengencerAlf;I think it's safe to assume that if you're looking for someone who's currently lactating you're much more likely to find a young woman than an old one. Especially back then when childbirth was way more dangerous than it is today and age of the mother is a massive indicator for maternal complications;https://oauth.reddit.com/r/todayilearned/comments/y382vf/til_that_pope_innocent_viii_was_breastfed_while.json;2
shastaxc;I don't think old women produce breast milk, but I don't really know if that's true;https://oauth.reddit.com/r/todayilearned/comments/y382vf/til_that_pope_innocent_viii_was_breastfed_while.json;2
R0b0tJesus;I've sucked on a lot of old lady tits, and haven't seen any milk so far. I guess I'll keep trying.;https://oauth.reddit.com/r/todayilearned/comments/y382vf/til_that_pope_innocent_viii_was_breastfed_while.json;3
Smolenski;Stop questioning the pope!;https://oauth.reddit.com/r/todayilearned/comments/y382vf/til_that_pope_innocent_viii_was_breastfed_while.json;2
donniebrascoreal;Not that innocent;https://oauth.reddit.com/r/todayilearned/comments/y382vf/til_that_pope_innocent_viii_was_breastfed_while.json;0
LifeWin;"I think I did it again; I made you believe we're more than just friends";https://oauth.reddit.com/r/todayilearned/comments/y382vf/til_that_pope_innocent_viii_was_breastfed_while.json;1
cybercuzco;"[oops I did it again](https://www.youtube.com/watch?v=VeiTtDf0E5M&amp;t=71s)";https://oauth.reddit.com/r/todayilearned/comments/y382vf/til_that_pope_innocent_viii_was_breastfed_while.json;1
LadyBug_0570;"And a liar, to boot.

The MF knew he could drink water, he just wanted to suck on titties as his dying wish.";https://oauth.reddit.com/r/todayilearned/comments/y382vf/til_that_pope_innocent_viii_was_breastfed_while.json;1
Nijajjuiy88;"well being fed on breast milk is different than sucking tits.

lol do people suck cow's udders for milk?";https://oauth.reddit.com/r/todayilearned/comments/y382vf/til_that_pope_innocent_viii_was_breastfed_while.json;2
dan420;Oh baby, baby!;https://oauth.reddit.com/r/todayilearned/comments/y382vf/til_that_pope_innocent_viii_was_breastfed_while.json;1
Specialist_Peach4294;"Especially when it was the cream of some young guys, soup.

It is said, that he died with a serene smile on his face like “Herbert the Pervert"", with “Kidz Bop” cds softly playing in the background, only the songs sung by prepubescent boys.

MMMBop (Whispered)";https://oauth.reddit.com/r/todayilearned/comments/y382vf/til_that_pope_innocent_viii_was_breastfed_while.json;1
hogtiedcantalope;Like a babe;https://oauth.reddit.com/r/todayilearned/comments/y382vf/til_that_pope_innocent_viii_was_breastfed_while.json;1
lucidum;Innocent enough;https://oauth.reddit.com/r/todayilearned/comments/y382vf/til_that_pope_innocent_viii_was_breastfed_while.json;1
Vaginalketchup;"How do you discover that the only thing you can eat or drink is breastmilk?

*Tries chicken. Nope*

*Tries donkey shit. Nope*

*Tries breast Milk. Yup, bring it.*";https://oauth.reddit.com/r/todayilearned/comments/y382vf/til_that_pope_innocent_viii_was_breastfed_while.json;0
Semiapies;He probably couldn't keep down porridge/pap, and that was probably something his doctors had recommended before for people in the same condition.;https://oauth.reddit.com/r/todayilearned/comments/y382vf/til_that_pope_innocent_viii_was_breastfed_while.json;1
Supertzar2112;Dude was a powerful man on his deathbed. Probably could have ate anything, just saw it was his last opportunity to suck a titty and took it;https://oauth.reddit.com/r/todayilearned/comments/y382vf/til_that_pope_innocent_viii_was_breastfed_while.json;1
WyrmHero1944;Genius;https://oauth.reddit.com/r/todayilearned/comments/y382vf/til_that_pope_innocent_viii_was_breastfed_while.json;2
Objective-Review4523;It wasn't like he could get breast fed by young boys.;https://oauth.reddit.com/r/todayilearned/comments/y382vf/til_that_pope_innocent_viii_was_breastfed_while.json;3
11DarkReign11;He used the other tap for that.;https://oauth.reddit.com/r/todayilearned/comments/y382vf/til_that_pope_innocent_viii_was_breastfed_while.json;4
Vaginalketchup;I wouldn't be surprised if he'd tried, though;https://oauth.reddit.com/r/todayilearned/comments/y382vf/til_that_pope_innocent_viii_was_breastfed_while.json;4
ToxicTaxiTaker;It was 1492, Donkey shit was way higher on the menu;https://oauth.reddit.com/r/todayilearned/comments/y382vf/til_that_pope_innocent_viii_was_breastfed_while.json;1
Tudyks;what about donkey balls?;https://oauth.reddit.com/r/todayilearned/comments/y382vf/til_that_pope_innocent_viii_was_breastfed_while.json;2
theguywiththeface;They’re generally mendacious and polyglottal;https://oauth.reddit.com/r/todayilearned/comments/y382vf/til_that_pope_innocent_viii_was_breastfed_while.json;3
Tudyks;Doors and corners;https://oauth.reddit.com/r/todayilearned/comments/y382vf/til_that_pope_innocent_viii_was_breastfed_while.json;4
ToxicTaxiTaker;In 1492, donkeys sprung out of the earth fully formed as was God's design.  They had no need for genitals until 1493;https://oauth.reddit.com/r/todayilearned/comments/y382vf/til_that_pope_innocent_viii_was_breastfed_while.json;3
Hewn-U;They’re lower down;https://oauth.reddit.com/r/todayilearned/comments/y382vf/til_that_pope_innocent_viii_was_breastfed_while.json;3
No_Banana_581;The poor woman that was forced to feed a corpse is who I feel sorry for;https://oauth.reddit.com/r/todayilearned/comments/y382vf/til_that_pope_innocent_viii_was_breastfed_while.json;1
HobgoblinKhanate;15th century and it was the pope. She’d have seen it was some immense blessing and would boast about it for the rest of her life;https://oauth.reddit.com/r/todayilearned/comments/y382vf/til_that_pope_innocent_viii_was_breastfed_while.json;2
No_Banana_581;Only if it brought opportunity. Idk if you’ve ever breastfed but it’s not fun definitely wouldn’t be fun to feed a half dead adult;https://oauth.reddit.com/r/todayilearned/comments/y382vf/til_that_pope_innocent_viii_was_breastfed_while.json;3
Yossarian1138;"From what I gather, the experience varies pretty wildly amongst women. Some absolutely love it, the majority seems to find it tolerable, some like doing it but the process isn’t always fun, a minority hate it.

I even knew of a friend of the family that enjoyed it so much she’d feed other peoples babies.  Which was weird, but helpful at times I guess.";https://oauth.reddit.com/r/todayilearned/comments/y382vf/til_that_pope_innocent_viii_was_breastfed_while.json;4
Lumpy-Spinach-6607;"Not that weird.

Back in the olden days, that was known as Wet Nursing.

A Wet Nurse could be hired just as easily as a Dry Cleaner";https://oauth.reddit.com/r/todayilearned/comments/y382vf/til_that_pope_innocent_viii_was_breastfed_while.json;5
Obversa;"Children fed by the same wet nurse were also called ""milk siblings"".

The concept of ""milk kinship"" was as follows:

&gt;Milk kinship, formed during nursing by a non-biological mother, was a form of fostering allegiance with fellow community members. This particular form of kinship did not exclude particular groups, such that class and other hierarchal systems did not matter in terms of milk kinship participation.  
&gt;  
&gt;Traditionally speaking, this practice predates the early modern period, though it became a widely used mechanism for developing alliances in many hierarchical societies during that time. Milk kinship used the practice of breast feeding by a wet nurse to feed a child either from the same community, or a neighbouring one. This wet nurse played the strategic role in forging relations between her family and the family of the child she was nursing, as well as their community.";https://oauth.reddit.com/r/todayilearned/comments/y382vf/til_that_pope_innocent_viii_was_breastfed_while.json;6
larryscathouse;The teeth alone…;https://oauth.reddit.com/r/todayilearned/comments/y382vf/til_that_pope_innocent_viii_was_breastfed_while.json;4
flyinhawaiian02;Ge was all gums at that point;https://oauth.reddit.com/r/todayilearned/comments/y382vf/til_that_pope_innocent_viii_was_breastfed_while.json;5
MartyMcfly1738;They probably made up some story to make it about god;https://oauth.reddit.com/r/todayilearned/comments/y382vf/til_that_pope_innocent_viii_was_breastfed_while.json;2
freecain;"From now on, when I bring up something improbable but true, my answer to ""is that for real?"" Is going to be ""does the pope breast feed?""";https://oauth.reddit.com/r/todayilearned/comments/y382vf/til_that_pope_innocent_viii_was_breastfed_while.json;0
Trans-Europe_Express;Yes, From the Holy C cup.;https://oauth.reddit.com/r/todayilearned/comments/y382vf/til_that_pope_innocent_viii_was_breastfed_while.json;1
Muroid;This is an amazing joke.;https://oauth.reddit.com/r/todayilearned/comments/y382vf/til_that_pope_innocent_viii_was_breastfed_while.json;2
G00DLuck;Miraculous;https://oauth.reddit.com/r/todayilearned/comments/y382vf/til_that_pope_innocent_viii_was_breastfed_while.json;3
Trans-Europe_Express;A lot of people do think the same thing every time they see a C cup to be fair.;https://oauth.reddit.com/r/todayilearned/comments/y382vf/til_that_pope_innocent_viii_was_breastfed_while.json;4
ItsTheExtreme;I didn’t know this was an option.;https://oauth.reddit.com/r/todayilearned/comments/y382vf/til_that_pope_innocent_viii_was_breastfed_while.json;0
Spring_Assembly;Not on the lowest tier of insurance for sure;https://oauth.reddit.com/r/todayilearned/comments/y382vf/til_that_pope_innocent_viii_was_breastfed_while.json;1
chang3la;If they put the breast milk in a cup would he have still drunk it?;https://oauth.reddit.com/r/todayilearned/comments/y382vf/til_that_pope_innocent_viii_was_breastfed_while.json;0
Gusta116;No;https://oauth.reddit.com/r/todayilearned/comments/y382vf/til_that_pope_innocent_viii_was_breastfed_while.json;1
samusear;Koala behavior;https://oauth.reddit.com/r/todayilearned/comments/y382vf/til_that_pope_innocent_viii_was_breastfed_while.json;2
ContagisBlondnes;I don't know if you've ever been hooked up to a double electric pump but it takes forever to get a couple ounces and that's a DOUBLE ELECTRIC PUMP.  Idk how they'd get it in a cup.;https://oauth.reddit.com/r/todayilearned/comments/y382vf/til_that_pope_innocent_viii_was_breastfed_while.json;1
Jazzlike-Werewolf554;Innocent on the bed;https://oauth.reddit.com/r/todayilearned/comments/y382vf/til_that_pope_innocent_viii_was_breastfed_while.json;0
niversally;But a freak on the teets.;https://oauth.reddit.com/r/todayilearned/comments/y382vf/til_that_pope_innocent_viii_was_breastfed_while.json;1
kristonastick;that's how i want to go...;https://oauth.reddit.com/r/todayilearned/comments/y382vf/til_that_pope_innocent_viii_was_breastfed_while.json;0
st3akkn1fe;Your nipples in a popes mouth?;https://oauth.reddit.com/r/todayilearned/comments/y382vf/til_that_pope_innocent_viii_was_breastfed_while.json;1
COGspartaN7;So long as someone appreciates my nipples;https://oauth.reddit.com/r/todayilearned/comments/y382vf/til_that_pope_innocent_viii_was_breastfed_while.json;2
zuckerle;I mean ... that's the breast way to go ...;https://oauth.reddit.com/r/todayilearned/comments/y382vf/til_that_pope_innocent_viii_was_breastfed_while.json;0
richv68;Bitty….;https://oauth.reddit.com/r/todayilearned/comments/y382vf/til_that_pope_innocent_viii_was_breastfed_while.json;0
tyleritis;Oh man that brings back memories. What a crazy skit;https://oauth.reddit.com/r/todayilearned/comments/y382vf/til_that_pope_innocent_viii_was_breastfed_while.json;1
Ser_Dunk_the_tall;No one calls me Number 2!!;https://oauth.reddit.com/r/todayilearned/comments/y382vf/til_that_pope_innocent_viii_was_breastfed_while.json;2
BlueHeisen;But you’ve just had bitty;https://oauth.reddit.com/r/todayilearned/comments/y382vf/til_that_pope_innocent_viii_was_breastfed_while.json;1
AustEastTX;Beat me to it;https://oauth.reddit.com/r/todayilearned/comments/y382vf/til_that_pope_innocent_viii_was_breastfed_while.json;1
jadraxx;PF Chang's, mostly. Good stuff.;https://oauth.reddit.com/r/todayilearned/comments/y382vf/til_that_pope_innocent_viii_was_breastfed_while.json;1
the_real_abraham;I'm not feeling well.;https://oauth.reddit.com/r/todayilearned/comments/y382vf/til_that_pope_innocent_viii_was_breastfed_while.json;0
Sneezarrhea;Now that’s the sort of hospice I’m signing up for;https://oauth.reddit.com/r/todayilearned/comments/y382vf/til_that_pope_innocent_viii_was_breastfed_while.json;0
-Lightning-Lord-;ho spice;https://oauth.reddit.com/r/todayilearned/comments/y382vf/til_that_pope_innocent_viii_was_breastfed_while.json;1
teflong;I'm not. That. Innocent!;https://oauth.reddit.com/r/todayilearned/comments/y382vf/til_that_pope_innocent_viii_was_breastfed_while.json;0
StarMasher;He just wanted to suck on some titties before he went. Now I know this comment isnt original, nor have I read the comment section... but I know I can find solidarity amongst redditors who agree with me.;https://oauth.reddit.com/r/todayilearned/comments/y382vf/til_that_pope_innocent_viii_was_breastfed_while.json;0
Captain_Comic;Don’t care, sucked tittles til I died -I dunno, Pope Innocent da 8 prolly;https://oauth.reddit.com/r/todayilearned/comments/y382vf/til_that_pope_innocent_viii_was_breastfed_while.json;0
nduanetesh;"""breastfed on my deathbed"" is definitely my band's next album title.";https://oauth.reddit.com/r/todayilearned/comments/y382vf/til_that_pope_innocent_viii_was_breastfed_while.json;0
Moody_GenX;I'm surprised there's no painting of it. The breast milk maid gently holding his head to her bosoms while he's nuzzling on her nipples. With little angel babies flying around waiting for him to die.;https://oauth.reddit.com/r/todayilearned/comments/y382vf/til_that_pope_innocent_viii_was_breastfed_while.json;0
dudemanbro44;Just the pope suckin on some titties;https://oauth.reddit.com/r/todayilearned/comments/y382vf/til_that_pope_innocent_viii_was_breastfed_while.json;1
jayb151;"Man, what an excuse.

Come on, I'm dying here. Flop a tiddie in my mouth!";https://oauth.reddit.com/r/todayilearned/comments/y382vf/til_that_pope_innocent_viii_was_breastfed_while.json;0
b666ne;Fucking legend;https://oauth.reddit.com/r/todayilearned/comments/y382vf/til_that_pope_innocent_viii_was_breastfed_while.json;0
Sanjuro7880;Is he the one who founded “Make a Wish”?;https://oauth.reddit.com/r/todayilearned/comments/y382vf/til_that_pope_innocent_viii_was_breastfed_while.json;0
TheDudeOntheCouch;Oldest trick in the book;https://oauth.reddit.com/r/todayilearned/comments/y382vf/til_that_pope_innocent_viii_was_breastfed_while.json;0
Webbk5;That fuckin sly dog;https://oauth.reddit.com/r/todayilearned/comments/y382vf/til_that_pope_innocent_viii_was_breastfed_while.json;0
Due-World2907;Dirty bastard till the end, oh yes it’s all I can drink;https://oauth.reddit.com/r/todayilearned/comments/y382vf/til_that_pope_innocent_viii_was_breastfed_while.json;0
superkamote;"Now I just need to casually suggest this to my wife, while omitting the ""deathbed"" part";https://oauth.reddit.com/r/todayilearned/comments/y382vf/til_that_pope_innocent_viii_was_breastfed_while.json;0
Majestic-Alfalfa-754;Yeah...that's the reason;https://oauth.reddit.com/r/todayilearned/comments/y382vf/til_that_pope_innocent_viii_was_breastfed_while.json;0
Gorge_Lorge;Riiiiight right riiiight.  Tucking this away for my brain when I’m an old man….;https://oauth.reddit.com/r/todayilearned/comments/y382vf/til_that_pope_innocent_viii_was_breastfed_while.json;0
want-to-say-this;I was not aware this was a treatment option covered by my insurance provider;https://oauth.reddit.com/r/todayilearned/comments/y382vf/til_that_pope_innocent_viii_was_breastfed_while.json;0
ocelotrevs;Having a titty in my mouth would be my final request if it was an option as well.;https://oauth.reddit.com/r/todayilearned/comments/y382vf/til_that_pope_innocent_viii_was_breastfed_while.json;0
Lemur718;Only the finest Cambodian breast milk.;https://oauth.reddit.com/r/todayilearned/comments/y382vf/til_that_pope_innocent_viii_was_breastfed_while.json;0
supermariobruhh;I get it. I'd wanna suck some tiddies if I was on my deathbed too.;https://oauth.reddit.com/r/todayilearned/comments/y382vf/til_that_pope_innocent_viii_was_breastfed_while.json;0
reddit_user13;I’m calling shenanigans.;https://oauth.reddit.com/r/todayilearned/comments/y382vf/til_that_pope_innocent_viii_was_breastfed_while.json;0
SwerveTheNerve;I wonder how they selected the woman to feed him.;https://oauth.reddit.com/r/todayilearned/comments/y382vf/til_that_pope_innocent_viii_was_breastfed_while.json;0
InflamedLiver;I’d say a nun, but I guess it’s not like a lot of them get pregnant;https://oauth.reddit.com/r/todayilearned/comments/y382vf/til_that_pope_innocent_viii_was_breastfed_while.json;1
FreneticPlatypus;"There’s plenty of stories of priests raping nuns and forcing abortions today, nothing going to make me think this was just a recent thing.  

https://www.pbs.org/newshour/show/abused-nuns-reveal-stories-of-rape-forced-abortions";https://oauth.reddit.com/r/todayilearned/comments/y382vf/til_that_pope_innocent_viii_was_breastfed_while.json;2
NicNoletree;Priests are discouraged from that. Nobody wants them to get into the habit.;https://oauth.reddit.com/r/todayilearned/comments/y382vf/til_that_pope_innocent_viii_was_breastfed_while.json;3
SvenHudson;Also, I assume women who are already mothers aren't forbidden from becoming nuns.;https://oauth.reddit.com/r/todayilearned/comments/y382vf/til_that_pope_innocent_viii_was_breastfed_while.json;3
jezreelite;They probably just had someone recommend their wet nurse. Most aristocratic women of the period didn't breastfed their own children (because breastfeeding can prevent conception), so they all relied on wet nurses.;https://oauth.reddit.com/r/todayilearned/comments/y382vf/til_that_pope_innocent_viii_was_breastfed_while.json;1
SatansMoisture;Hell of a way to go. I'm a little jealous.;https://oauth.reddit.com/r/todayilearned/comments/y382vf/til_that_pope_innocent_viii_was_breastfed_while.json;0
VinceDaPazza;Every time I have an upset stomach I tell my wife this, no go she says!;https://oauth.reddit.com/r/todayilearned/comments/y382vf/til_that_pope_innocent_viii_was_breastfed_while.json;0
MrBrad85;**St Peter**   Congratulations Pope, you successfully maintained your vow of celibacy for your entire, oh.  Oh dear.  Erm, I'll have to consult the rule book.  Be right back.;https://oauth.reddit.com/r/todayilearned/comments/y382vf/til_that_pope_innocent_viii_was_breastfed_while.json;0
Zuesinator;"""If I'm leaving this world, I'm going out the same way I came in""";https://oauth.reddit.com/r/todayilearned/comments/y382vf/til_that_pope_innocent_viii_was_breastfed_while.json;0
greenwoody2018;It's good to be the Pope!;https://oauth.reddit.com/r/todayilearned/comments/y382vf/til_that_pope_innocent_viii_was_breastfed_while.json;0
okletmethink420;Bring forth the tit.;https://oauth.reddit.com/r/todayilearned/comments/y382vf/til_that_pope_innocent_viii_was_breastfed_while.json;0
Embarker;They brought in a Cambodian immigrant, only the finest breast milk for the pope;https://oauth.reddit.com/r/todayilearned/comments/y382vf/til_that_pope_innocent_viii_was_breastfed_while.json;0
RantControl;Innocent my ass /s;https://oauth.reddit.com/r/todayilearned/comments/y382vf/til_that_pope_innocent_viii_was_breastfed_while.json;0
HairTop23;"That's gross af

Was that the same pope who gave his sex slave a position in the church so he could continue sexually abusing him without raising suspicions? I would say male lover, but from what I read about the boy he was never a willing participant.";https://oauth.reddit.com/r/todayilearned/comments/y382vf/til_that_pope_innocent_viii_was_breastfed_while.json;0
CaptRackham;That sounds like the kind of lie I would come up with.;https://oauth.reddit.com/r/todayilearned/comments/y382vf/til_that_pope_innocent_viii_was_breastfed_while.json;0
Rogue-Gentleman;I predict that I’ll also need this treatment.;https://oauth.reddit.com/r/todayilearned/comments/y382vf/til_that_pope_innocent_viii_was_breastfed_while.json;0
Bismarck_97;I am going to try that with my crush brb;https://oauth.reddit.com/r/todayilearned/comments/y382vf/til_that_pope_innocent_viii_was_breastfed_while.json;0
washingtonandmead;Need an update;https://oauth.reddit.com/r/todayilearned/comments/y382vf/til_that_pope_innocent_viii_was_breastfed_while.json;1
