qft;Careful, this is how fedoras happened;https://oauth.reddit.com/r/todayilearned/comments/y2yfwj/til_in_1912_4_yrold_bobby_dunbar_disappeared_was.json;4
Mediocritologist;M’changeling (tips cloche);https://oauth.reddit.com/r/todayilearned/comments/y2yfwj/til_in_1912_4_yrold_bobby_dunbar_disappeared_was.json;5
Ok_Skill_1195;"Yeah shortly after posting this it suddenly occured to me how close I came to being the female equivalent to being ""the fedora dude"".";https://oauth.reddit.com/r/todayilearned/comments/y2yfwj/til_in_1912_4_yrold_bobby_dunbar_disappeared_was.json;5
TheLurkerSpeaks;"There's absolutely nothing inherently wrong with a fedora, it just needs to be worn with matching slacks and blazer. The cringe comes from guys wearing it with t-shirts and cargo shorts.

Same goes for a cloche, you wear it with fine gowns and frock coats and what not you can look great. Just don't pair it with sweats and yoga pants.";https://oauth.reddit.com/r/todayilearned/comments/y2yfwj/til_in_1912_4_yrold_bobby_dunbar_disappeared_was.json;6
Fingercult;Nah it’s extremely trendy right now with the young ones, they’re back to being everywhere in the malls from fast fashion to high end;https://oauth.reddit.com/r/todayilearned/comments/y2yfwj/til_in_1912_4_yrold_bobby_dunbar_disappeared_was.json;3
NeedsToShutUp;Written by JMS, the creator of Babylon 5;https://oauth.reddit.com/r/todayilearned/comments/y2yfwj/til_in_1912_4_yrold_bobby_dunbar_disappeared_was.json;1
sassathefras;There’s a good episode of the Stuff You Should Know podcast where they talk about this case. Christine Collins is the mother and her son is Walter. It’s a pretty messed up situation.;https://oauth.reddit.com/r/todayilearned/comments/y2yfwj/til_in_1912_4_yrold_bobby_dunbar_disappeared_was.json;1
RyantheAustralian;I thought that was the case this post was referring to. It's horrific;https://oauth.reddit.com/r/todayilearned/comments/y2yfwj/til_in_1912_4_yrold_bobby_dunbar_disappeared_was.json;1
tipdrill541;"This is fucked up. The Dunbar family was camping and Bobby went missing at night. It was concluded he drowned in a near by lake but was later suspected to have been kidnapped when his hat was found some distance from the lake 

Authorities came across a travelling sales man named William Cantwell Walters. He was accompanied by a 4 year old boy. The same age and appearance of Bobby. Walters said the boy was Bruce Anderson, the illegitimate son of Julia Anderson, his parents care taker.

Walters said he had permission to take the boyand Julia said that was true, but only for 2 days. He had been with Walters for over a year. She never reported Walters to the police, despite the fact that her son was only meant to be away for 2 days

They had the Dunbar parents examine the boy and meet him, but when they met, what happened next is disputed. Leslie Dunbar identified him as hers through moles and scars but the public thought this was suspicious as he was only missing for 8 months so she should have been able to tell whether it was him hy his face

Julia Anderson was also brought in to identify her supposed son. 4 boys were brought in one ag a time including Bruce. She didn't recognise any of them and none of them recognised hers. She requested they eb brought in again and recognised Bruce as hers after she undressed him and checked his moles 

William Cantwell Walters was convicted of kidnapping in 1914 despite people in Mississippi swearing that he had been traveling with the boy long before Bobby Dunbar disappeared. Walters won a new trial on appeal but because of the expense involved, authorities declined to try him again. He was released from jail after serving two years.

Many years later, Margaret Dunbar Cutright and Linda Traver, the respective granddaughters of Bobby Dunbar and Julia Anderson, set out to solve the Bobby Dunbar mystery. After much investigation, Margaret finally convinced her father, Robert Dunbar Jr., to submit to a DNA test.

The result showed that he was not related to the Dunbars at all; Bobby Dunbar, was in fact, Julia Anderson’s son, Bruce. 
Cutright and other family members suspect that Walters was Bruce’s father or uncle and that he had taken the boy in because his mother could not care for him.

From this article it sounds like Julia was ashamed of the situation. Ashamed that she was away from her child for over a year so she lied and said Walters was only supposed to take him for two years.

The Dunbars were able to put out a $6000 dollar reward ($160 000 in today's money for information a about their sons kidnapping. So they were rich. They wanted a replacement child and the authorities were on their side, so they were able to take another person's child";https://oauth.reddit.com/r/todayilearned/comments/y2yfwj/til_in_1912_4_yrold_bobby_dunbar_disappeared_was.json;0
NurseMcStuffins;I feel bad for Walters. Trying to take care of the kid, gets put in jail and kid taken away. The kids mom sounds like she was already kinda out of the picture...;https://oauth.reddit.com/r/todayilearned/comments/y2yfwj/til_in_1912_4_yrold_bobby_dunbar_disappeared_was.json;1
beldaran1224;"Women at that time had much fewer options than today. Since she wasn't married, she would have had no way to legally get support for the boy from the father (I don't even know if child support was even a thing then?). She would have found it much more difficult to get work than a modern woman, and the work would have been much less able to support her and a child.

Especially if Walters was the father or uncle, it makes perfect sense.";https://oauth.reddit.com/r/todayilearned/comments/y2yfwj/til_in_1912_4_yrold_bobby_dunbar_disappeared_was.json;2
tipdrill541;Yes, it wasnt like he kidnapped the kid and there is not mention anywhere of him harming the kid. And the kid was either his son or nephew through his brother. Another article says that Julia went to look for work and left Walters to care for the boy;https://oauth.reddit.com/r/todayilearned/comments/y2yfwj/til_in_1912_4_yrold_bobby_dunbar_disappeared_was.json;2
bkconn;"&gt; Leslie Dunbar identified him as hers through makes and scars butter public thought this was suspicious...

HUH?";https://oauth.reddit.com/r/todayilearned/comments/y2yfwj/til_in_1912_4_yrold_bobby_dunbar_disappeared_was.json;1
SeanBeansFetus;"I'm guessing ""through marks (or moles) and scars but the public thought this was suspicious"" if that's what you were asking";https://oauth.reddit.com/r/todayilearned/comments/y2yfwj/til_in_1912_4_yrold_bobby_dunbar_disappeared_was.json;2
xDaigon_Redux;To completely clarify, Mrs Dunbar was only able to identify the boy as hers, even though he wasn't, through looking at marks and scars on the boys body. People found this suspicious because they believed it was strange that a mother wouldn't outright recognize her son after him only being missing for around 8 months and she had to match the marks and scars to determine that he was her son.;https://oauth.reddit.com/r/todayilearned/comments/y2yfwj/til_in_1912_4_yrold_bobby_dunbar_disappeared_was.json;2
Masanjay_Dosa;Assuming autocorrect gore. I read it as “through marks and scars but the public…”;https://oauth.reddit.com/r/todayilearned/comments/y2yfwj/til_in_1912_4_yrold_bobby_dunbar_disappeared_was.json;2
dharmadhatu;"What don't you understand? HERS THROUGH MAKES AND SCARS BUTTER PUBLIC THOUGHT THIS!

(I think it's supposed to be ""identified him as hers through marks and scars, but the police thought this was suspicious""). Edit: partly right.";https://oauth.reddit.com/r/todayilearned/comments/y2yfwj/til_in_1912_4_yrold_bobby_dunbar_disappeared_was.json;2
tjcline09;"The book ""A Case for Solomon"" is written about this. I own it and have read it a couple times because it's crazy to me.";https://oauth.reddit.com/r/todayilearned/comments/y2yfwj/til_in_1912_4_yrold_bobby_dunbar_disappeared_was.json;0
3_7_11_13_17;"The Judgment of Solomon is a biblical tale about this. Two women claim the child is their own, King Solomon says the only fair answer is to cut the child in half and give each woman one half of the child. One woman immediately pleads that the other woman just be given the child instead, with the conclusion being that she is the real mother. King Solomon gives the child to her. 

I'm not Christian, but that's a good tale.";https://oauth.reddit.com/r/todayilearned/comments/y2yfwj/til_in_1912_4_yrold_bobby_dunbar_disappeared_was.json;1
Thediciplematt;What a nightmare. The court system must have been tough for the innocent without DNA.;https://oauth.reddit.com/r/todayilearned/comments/y2yfwj/til_in_1912_4_yrold_bobby_dunbar_disappeared_was.json;0
I_might_be_weasel;Obviously the judge should have told them to divide the child in half.;https://oauth.reddit.com/r/todayilearned/comments/y2yfwj/til_in_1912_4_yrold_bobby_dunbar_disappeared_was.json;1
251Cane;No, let her keep the bike. I don’t want it to be destroyed. She can have it, I beg you.;https://oauth.reddit.com/r/todayilearned/comments/y2yfwj/til_in_1912_4_yrold_bobby_dunbar_disappeared_was.json;2
That_Ganderman;"“She can have the top part.

This woman was so fucked up, that she called the head… the *top part*.”";https://oauth.reddit.com/r/todayilearned/comments/y2yfwj/til_in_1912_4_yrold_bobby_dunbar_disappeared_was.json;2
tipdrill541;"The boy was with a man whose parents had employed the boys mother as a care taker. He was described as an itinerant peddler.  Basically a travelling salesman. Lots of people in Mississippi had seen him with the boy for a long period of time before Bobby Dunbar was kidnapped.

DNA testing was needed. They just wanted to take the boy and give him to the Dunbars";https://oauth.reddit.com/r/todayilearned/comments/y2yfwj/til_in_1912_4_yrold_bobby_dunbar_disappeared_was.json;1
w0weez0wee;There's a great This American Life episode about this;https://oauth.reddit.com/r/todayilearned/comments/y2yfwj/til_in_1912_4_yrold_bobby_dunbar_disappeared_was.json;0
Comprehensive-Fun47;I've always wanted an update to that episode. Some of the family members refused to believe the results and it caused a rift. I wonder if they ever mended the rift.;https://oauth.reddit.com/r/todayilearned/comments/y2yfwj/til_in_1912_4_yrold_bobby_dunbar_disappeared_was.json;1
mumblewrapper;They just re ran the episode a few weeks ago. I think they do an update...;https://oauth.reddit.com/r/todayilearned/comments/y2yfwj/til_in_1912_4_yrold_bobby_dunbar_disappeared_was.json;2
Double-Drop;"This is the episode that gave me one my favorite English language gems.  A lady from the south, I think South Carolina, describes her neighbor as being, ""uglier than home made sin"". Omfg! That's some sinister, macabre level of ugly. Nasty dirty take a shower can't wash it off, can't wash it off kind of ugly. Brilliant, eloquent, concise and poetic conveyance of a thought.";https://oauth.reddit.com/r/todayilearned/comments/y2yfwj/til_in_1912_4_yrold_bobby_dunbar_disappeared_was.json;1
sethra007;"&gt;*""uglier than homemade sin"".*

Oh, wow, that's an *old* Southern-ism.  I think my grandma's cousin used to say that one.";https://oauth.reddit.com/r/todayilearned/comments/y2yfwj/til_in_1912_4_yrold_bobby_dunbar_disappeared_was.json;2
RobotGhostZero;I never had any doubts that my dad was my dad.  My mom was adopted and so was my parental grandfather.  Took an AncestryDNA and wouldn't you know?  My dad wasn't my dad, woops!;https://oauth.reddit.com/r/todayilearned/comments/y2yfwj/til_in_1912_4_yrold_bobby_dunbar_disappeared_was.json;0
bluejaymaday;Whenever this comes up the real tragedy of the case seems to be glossed over in favour of the salacious fake child/kidnapping situation, however the saddest victim involved is kind of forgotten. The ‘real’ Bobby Dunbar was just left behind by the world. We still don’t know whether he died at the time he went missing or was kidnapped and taken away but the fact that just 8 months after his disappearance his family had replaced him, knowingly or not, is just heartbreaking. They didn’t just take another family’s kid by dubbing this other boy to be Bobby, they also destroyed any chance of the real Bobby’s disappearance being solved before the case went cold, stopping the investigation while Bobby’s remains or the child himself were still in need of being found. He deserved better from his family and the police.;https://oauth.reddit.com/r/todayilearned/comments/y2yfwj/til_in_1912_4_yrold_bobby_dunbar_disappeared_was.json;0
W_O_M_B_A_T;In light of the behavior of the family and especially Bobby's mother, it seems suspicious that they were trying to cover up for the real circumstances of bobby's death and take the heat off themselves. But, I dunno. The trauma of losing one's child. Grief can do wild things to people.;https://oauth.reddit.com/r/todayilearned/comments/y2yfwj/til_in_1912_4_yrold_bobby_dunbar_disappeared_was.json;1
hanatheko;... I think the parents who had their kid taken from them suffered a great ton as well.;https://oauth.reddit.com/r/todayilearned/comments/y2yfwj/til_in_1912_4_yrold_bobby_dunbar_disappeared_was.json;1
BS9966;"If he drowned, how did the body just disappear?

 It would have eventually come up to shore without weight. 
Did they not search the lake at all?";https://oauth.reddit.com/r/todayilearned/comments/y2yfwj/til_in_1912_4_yrold_bobby_dunbar_disappeared_was.json;1
Alpha_Zerg;"There's a book on a similar story in South Africa, called Fiela se Kind (Fiela's Child), set before Apartheid times. It's about a white boy who was raised by a coloured woman named Fiela, only for the magistrate to have the boy taken from his mother a few years later because a white Afrikaans family lost their child and they came to the conclusion that it must be the same child.

&gt;!The plot develops with the child eventually making the new ""mother"" confess that he wasn't her child, and he leaves to go back to his adopted coloured mother.!&lt;

It's a pretty good book discussing racism, classism, and choosing who your family is.";https://oauth.reddit.com/r/todayilearned/comments/y2yfwj/til_in_1912_4_yrold_bobby_dunbar_disappeared_was.json;0
bqzs;There's another great book that I always feel like would have made a great TV show called the Face on the Milk Carton with somewhat similar premise. Essentially it's about this upper middle class teenage girl raised as an only child by two older but highly involved parents in Connecticut, who sees her own face as a 2-year-old on a milk carton. The whole story unspools but essentially she's actually the third of six children from a lower middle class family in the midwest. That's the first half of the first book, where normally the story would end with a happily ever after reunion, but instead the book and the sequels focus on the incredibly complicated relationships and perspectives.;https://oauth.reddit.com/r/todayilearned/comments/y2yfwj/til_in_1912_4_yrold_bobby_dunbar_disappeared_was.json;1
slow_work_day;"&gt;Face on the Milk Carton

[https://www.youtube.com/watch?v=wbwuxoYBR4o](https://www.youtube.com/watch?v=wbwuxoYBR4o)

I'm pretty sure there were a few shows/movies on it, great story.";https://oauth.reddit.com/r/todayilearned/comments/y2yfwj/til_in_1912_4_yrold_bobby_dunbar_disappeared_was.json;2
stitchplacingmama;I was just talking about this book in another sub. I read the whole series as a teen. It was so good.;https://oauth.reddit.com/r/todayilearned/comments/y2yfwj/til_in_1912_4_yrold_bobby_dunbar_disappeared_was.json;2
bqzs;"I really feel like it would still make a good TV show, I think it had a made-for-TV hallmark-y movie but it's really the kind of story that you could play out for multiple seasons. 

The books showed her in college looking for her ""adoptive"" mother and dealing with the death of one of her four parents IIRC. It's so character-driven that it actually ages well too, unlikely a lot of pre-internet stories where modern technology effectively ruins the plot. In the original book, she finds herself on a milk cartoon, recognizes the dress and her face, digs for the dress in her parents' attic, does some research at the library on news articles with little info, semi-accidentally mails a letter to the family's home (which they've made public so she could find them again). A big plot point whether the biological parents should let her talk on the phone or visit with her parents/family/friends for unlimited amounts of time or limit it so she can better settle in. You just need to change research at the library for googling a few low-information articles and change landline phone conversations with being glued to her cell phone.

There was a somewhat similar show switched at birth which is the worst title but again semi-similar premise (hospital baby switch, different income levels and race) with the added complexity of one girl being deaf from catching meningitis as a toddler and both sets of parents and kids having to grapple with the paths not taken and one set of parents having to learn about Deaf culture etc.";https://oauth.reddit.com/r/todayilearned/comments/y2yfwj/til_in_1912_4_yrold_bobby_dunbar_disappeared_was.json;3
intet42;"When I learned about that story I spent months going ""You have to hear the craziest missing child story ever!"" Then I learned about this one: https://twitter.com/sittinginapark/status/1504612631881175048?s=20&amp;t=PETOP5hiTvTeyfPKtNL74g";https://oauth.reddit.com/r/todayilearned/comments/y2yfwj/til_in_1912_4_yrold_bobby_dunbar_disappeared_was.json;0
DoktorAusgezeichnet;"Likely this story:
https://www.independent.co.uk/news/world/americas/girl-kidnapped-during-house-fire-is-reunited-with-mother-after-six-years-565835.html

It's paywalled, but you can circumvent that with reader-view.";https://oauth.reddit.com/r/todayilearned/comments/y2yfwj/til_in_1912_4_yrold_bobby_dunbar_disappeared_was.json;1
Reuniclus_exe;She spotted her kidnapped, 10-day old baby, at a birthday party six years later because of her dimples. And DNA result showed she was right. That's incredible.;https://oauth.reddit.com/r/todayilearned/comments/y2yfwj/til_in_1912_4_yrold_bobby_dunbar_disappeared_was.json;2
cortexstack;"Its a soft paywall: you can circumvent it by clicking ""I'll sign up later""";https://oauth.reddit.com/r/todayilearned/comments/y2yfwj/til_in_1912_4_yrold_bobby_dunbar_disappeared_was.json;2
Yglorba;"Imagine how utterly confusing that must have been for the poor kid.  She was kidnapped when she was *ten days old*, so there's no way she knew any of this, just suddenly one day ""whoops, the parents you thought were your parents weren't really, we're sending them off to jail, here's your real parents who you never met before, have a nice life!""";https://oauth.reddit.com/r/todayilearned/comments/y2yfwj/til_in_1912_4_yrold_bobby_dunbar_disappeared_was.json;2
billy_teats;https://www.cnn.com/2004/US/Northeast/03/01/girl.found.alive/;https://oauth.reddit.com/r/todayilearned/comments/y2yfwj/til_in_1912_4_yrold_bobby_dunbar_disappeared_was.json;2
billy_teats;"https://www.cnn.com/2004/US/Northeast/03/01/girl.found.alive/

It was a woman who was formerly romantic with the father. She visits immediately before the fire but is never investigated. Then when the mother finds her own baby, she tells the police who allowed the woman to run away again and is still at large. So now the fugitive left her 6yo stolen daughter as well as two other kids. So these two other kids now have no mother, they discover their 6yo sister is the victim of a kidnapping crime and won’t be part of their lives anymore. This one woman did so much damage to so many people and is just walking around right now with some other name. Probably thinking about stealing children";https://oauth.reddit.com/r/todayilearned/comments/y2yfwj/til_in_1912_4_yrold_bobby_dunbar_disappeared_was.json;1
hlgb2015;Nah, that's an old article from when it all happened. They caught her and she got 30 years for arson and kidnapping. Kidnappers name is Carolyn Correa.;https://oauth.reddit.com/r/todayilearned/comments/y2yfwj/til_in_1912_4_yrold_bobby_dunbar_disappeared_was.json;2
shpoopie2020;Wow why did the fire fighters do that? They must have been paid off or something;https://oauth.reddit.com/r/todayilearned/comments/y2yfwj/til_in_1912_4_yrold_bobby_dunbar_disappeared_was.json;1
ilalli;The baby was gone before the fire started — the lady who stole the baby set the fire to cover up the kidnapping.;https://oauth.reddit.com/r/todayilearned/comments/y2yfwj/til_in_1912_4_yrold_bobby_dunbar_disappeared_was.json;2
Bob_Hondo_Sura;"Why the hell is anyone kidnapping their neighbors kid?!?! Why would anyone want a child so much?? They are great but HOW DO PEOPLE AFFORD THIS SHIT. 

that’s what baffles me about a lot of these types of stories, how the fuck do they have this kind of time??";https://oauth.reddit.com/r/todayilearned/comments/y2yfwj/til_in_1912_4_yrold_bobby_dunbar_disappeared_was.json;1
SplitLevel17;They just stole someone’s child?!?;https://oauth.reddit.com/r/todayilearned/comments/y2yfwj/til_in_1912_4_yrold_bobby_dunbar_disappeared_was.json;0
bqzs;"Seems like maybe they knew from the beginning that it wasn't their son, and decided to keep him anyway. He was only gone for 8 months, it would have been obvious.

But I guess we'll never know how much of that was them selfishly wanting it to be true and forcing it to work, vs. how much of it was Bobby wanting to stay with them and them seeing it as a sort of win/win (unless you count Bruce's mother). He clearly kept identifying as Bobby Dunbar for the rest of his life.";https://oauth.reddit.com/r/todayilearned/comments/y2yfwj/til_in_1912_4_yrold_bobby_dunbar_disappeared_was.json;0
conquer69;Or maybe he was brainwashed. He was young enough for implanted memories to be quite effective.;https://oauth.reddit.com/r/todayilearned/comments/y2yfwj/til_in_1912_4_yrold_bobby_dunbar_disappeared_was.json;1
Murky_Conflict3737;Plus, be bribed with toys and treats from the wealthy parents;https://oauth.reddit.com/r/todayilearned/comments/y2yfwj/til_in_1912_4_yrold_bobby_dunbar_disappeared_was.json;2
Sarcosmonaut;Just sad all around;https://oauth.reddit.com/r/todayilearned/comments/y2yfwj/til_in_1912_4_yrold_bobby_dunbar_disappeared_was.json;2
Responsible_Candle86;No way I would not know my own son, especially at 4 years old and gone less than a year. This story is weird start to finish.;https://oauth.reddit.com/r/todayilearned/comments/y2yfwj/til_in_1912_4_yrold_bobby_dunbar_disappeared_was.json;0
PubFiction;"Lets pretend the conspiracy theories are not the real answer. 

If you get past that then the next issue is emotions. If you were a parent and your kid was gone and you were very emotionally disturbed you might be susceptible to any form of hope. 

To make it obvious why do you think African Princes so easily swindle some Americans? The answer is hope, the same with most scams. Your brain sort of turns off and fails to accurately assess the situation when you emotionally want the truth to be a good outcome.";https://oauth.reddit.com/r/todayilearned/comments/y2yfwj/til_in_1912_4_yrold_bobby_dunbar_disappeared_was.json;1
the_blessed_unrest;Grief can make you do weird things, I guess;https://oauth.reddit.com/r/todayilearned/comments/y2yfwj/til_in_1912_4_yrold_bobby_dunbar_disappeared_was.json;1
ebbiibbe;Some rich people stole a kid. Not surprising.;https://oauth.reddit.com/r/todayilearned/comments/y2yfwj/til_in_1912_4_yrold_bobby_dunbar_disappeared_was.json;0
Petorian343;It's a reverse Raising Arizona!;https://oauth.reddit.com/r/todayilearned/comments/y2yfwj/til_in_1912_4_yrold_bobby_dunbar_disappeared_was.json;1
Finito-1994;"I’ve read about this. 

The kid eventually grew up and went to see his real family. He met his mom and siblings. It was never deep. They mostly just stared at each other. 

His mom became a great woman and a pillar of her community but people said there was always a sadness to her. It makes sense. The other family ran a smear campaign on her that was insane. For a poor mother she had no way to fight back and defend herself. 

The woman that took him was also very similar. 

Apparently during the trial these women gave each other psychological wounds that would never heal. I believe the woman that took him knew that he wasn’t her son but that she denied it because the thought that her kid was dead was too much for her.";https://oauth.reddit.com/r/todayilearned/comments/y2yfwj/til_in_1912_4_yrold_bobby_dunbar_disappeared_was.json;0
noxii3101;I learned about this from the Ghoul Boys;https://oauth.reddit.com/r/todayilearned/comments/y2yfwj/til_in_1912_4_yrold_bobby_dunbar_disappeared_was.json;0
EightRules;The Buzzfeed Unsolved boys (Ryan and Shane) covered this a while ago. Interesting watch on YouTube. (and yes, Buzzfeed sucks. Not that channel though);https://oauth.reddit.com/r/todayilearned/comments/y2yfwj/til_in_1912_4_yrold_bobby_dunbar_disappeared_was.json;0
ryazaki;the ghoul boys, at it again.;https://oauth.reddit.com/r/todayilearned/comments/y2yfwj/til_in_1912_4_yrold_bobby_dunbar_disappeared_was.json;1
LifeSizeDeity00;How does that happen? Was there no one that could corroborate that the Andersons had a child and watched him grow to the age of four. Like no one? Not a grocery clerk, soda jerk, or neighbor?;https://oauth.reddit.com/r/todayilearned/comments/y2yfwj/til_in_1912_4_yrold_bobby_dunbar_disappeared_was.json;0
