Nobutthenagain;I dont know, I'm not used to this stuff in this subreddit. Pitchfork or not pitchfork...;https://oauth.reddit.com/r/todayilearned/comments/y35b5d/til_sugar_does_not_cause_hyperactivity_in.json;2
stygyan;"I think we sometimes overlook the simpler explanations in life.

Children tend to eat sugary shit in social situations like birthday parties, trick or treating, and other kinds of excitable situations which may as well cause hyperactivity.

To use an adult analog, I don't get horny just because I'm naked. I get horny when I get naked next to other people.";https://oauth.reddit.com/r/todayilearned/comments/y35b5d/til_sugar_does_not_cause_hyperactivity_in.json;1
Earthguy69;"Artificial sweeteners such as aspartam does NOT increase blood glucose. This is however a myth that is still being told by people that have zero concept about how insulin works or how glucose is regulated.
 
Maltodextrin is not even in the same realm as other sweeteners. Maltodextrin is literally sugar.
 
Please stop.";https://oauth.reddit.com/r/todayilearned/comments/y35b5d/til_sugar_does_not_cause_hyperactivity_in.json;1
Holeinmysock;Full sugar redbulls do not cause hyperactivity in children when Starbucks’ cinnamon dulce lattes are the control.;https://oauth.reddit.com/r/todayilearned/comments/y35b5d/til_sugar_does_not_cause_hyperactivity_in.json;1
NadirPointing;"So the thing I can't square is that clearly sugar has mood effects, more strictly in the blood-sugar levels are directly correlated with mood and behavior. In adults, depression, sadness and lethargy at the low end and anxiety and anger at the high end. When you taste sugar you get a dopamine hit, but it also happens on injection. There is a well known sugar withdrawal effects of headaches and dizziness during extreme diet changes. Further there are  studies about sucrose ingestion subsequently having dramatic changes in mood and behavior. It makes me think this ""hyperactivity"" measure is the element that's not sensitive to sugar rather than that it doesn't cause effects.  
[https://www.researchgate.net/publication/20785190\_Sucrose\_and\_Delinquency\_Behavioral\_Assessment](https://www.researchgate.net/publication/20785190_Sucrose_and_Delinquency_Behavioral_Assessment)

[https://www.researchgate.net/publication/354018985\_Roles\_of\_Glucose\_and\_Sucrose\_Intakes\_on\_the\_Brain\_Functions\_Measured\_by\_the\_Working\_Ability\_and\_Morris\_Maze](https://www.researchgate.net/publication/354018985_Roles_of_Glucose_and_Sucrose_Intakes_on_the_Brain_Functions_Measured_by_the_Working_Ability_and_Morris_Maze)

[https://pubmed.ncbi.nlm.nih.gov/2699194/](https://pubmed.ncbi.nlm.nih.gov/2699194/)";https://oauth.reddit.com/r/todayilearned/comments/y35b5d/til_sugar_does_not_cause_hyperactivity_in.json;0
WritingTheRongs;In my professional experience, high blood sugar makes adults a little dopey or sometimes no reaction at all . low sugar makes them agitated, tachycardic, sweaty, and then eventually dead;https://oauth.reddit.com/r/todayilearned/comments/y35b5d/til_sugar_does_not_cause_hyperactivity_in.json;1
masheduppotato;"As a diabetic, all the low blood sugar stuff you’ve said is spot on for me. I haven’t died yet though so can’t fully confirm that but lost a great grand parent to too low blood sugar. 

High blood sugar does make me dopey and forgetful but prolonged high blood sugar (A1C) makes me very short tempered and aggressive.";https://oauth.reddit.com/r/todayilearned/comments/y35b5d/til_sugar_does_not_cause_hyperactivity_in.json;2
teatabby;Also T1D. The prolonged high blood sugar makes me so agitated at every little thing. I have no clue why it does that, but man it’s annoying.;https://oauth.reddit.com/r/todayilearned/comments/y35b5d/til_sugar_does_not_cause_hyperactivity_in.json;3
BlazerStoner;"Yeah most people I’ve spoken with say they get cranky from low BG. I don’t, I get slow and get a form of the munchies. When extremely low this is combined with survival panic kicking in, which is an odd thing to do your best to ignore and ride out waiting for medicinal cupcakes, red bull, M&amp;M’s or whatever to kick in. But high BG…? That gets me really cranky and short tempered. And sometimes sleepy.";https://oauth.reddit.com/r/todayilearned/comments/y35b5d/til_sugar_does_not_cause_hyperactivity_in.json;4
HopperPI;100%. I’ve experienced this and so have others I know who are type 1 and 2.;https://oauth.reddit.com/r/todayilearned/comments/y35b5d/til_sugar_does_not_cause_hyperactivity_in.json;4
Disastrous-Item-9762;"&gt; In my professional experience

What do you do professionally?";https://oauth.reddit.com/r/todayilearned/comments/y35b5d/til_sugar_does_not_cause_hyperactivity_in.json;2
Shloppins;That's William Wonka you've replied to show some respect;https://oauth.reddit.com/r/todayilearned/comments/y35b5d/til_sugar_does_not_cause_hyperactivity_in.json;3
missing_finder;How can we be sure he's talking about common adults and not adult oompa loompas?;https://oauth.reddit.com/r/todayilearned/comments/y35b5d/til_sugar_does_not_cause_hyperactivity_in.json;4
Isthisworking2000;I get everything with low blood sugar. But there is a silver lining. Whatever you end up eating when you’re really low is always the best thing you’ve ever had.;https://oauth.reddit.com/r/todayilearned/comments/y35b5d/til_sugar_does_not_cause_hyperactivity_in.json;2
brown-moose;"Most of these studies are on mice/rats, not children. Dopamine hits =\= hyperactivity. There is a huge difference between consumption &amp; low blood sugar, and the impact of sugar on a healthy, already fed child.";https://oauth.reddit.com/r/todayilearned/comments/y35b5d/til_sugar_does_not_cause_hyperactivity_in.json;1
ILikeLenexa;This statement would support the idea that *eating* causes hyperactivity, not exactly that *eating sugar* causes hyperactivity.;https://oauth.reddit.com/r/todayilearned/comments/y35b5d/til_sugar_does_not_cause_hyperactivity_in.json;1
Additional_Hunt_1639;"Blood-sugar doesn't have much of a relationship to intake of fructose. You'd expect eating a sandwich etc to have a bigger effect than a candy bar, blood ""sugar"" is actually glucose levels and they only called it ""sugar"" because doctors noticed that diabetic blood was sweet.

The addictive properties of sugar are on point though– likely the ""sugar rush"" comes from kids who rarely get to eat sugar being allowed some on a special occasion, getting a dopamine hit to which they have no tolerance and getting a little high.";https://oauth.reddit.com/r/todayilearned/comments/y35b5d/til_sugar_does_not_cause_hyperactivity_in.json;1
Celadorkable;The theory that makes sense to me is kids tend to have a lot of sugar during special events, so it's the event that hypes them up. (Fairy floss at a fair, chocolate at Easter, cake and lollies at birthday parties. Events when kids would be running around and surrounded by a lot of people they don't usually see, so they get hyped up by tjeir surrpundings);https://oauth.reddit.com/r/todayilearned/comments/y35b5d/til_sugar_does_not_cause_hyperactivity_in.json;2
TactileMist;"Isn't it called sugar because glucose is a sugar, like fructose or galactose? It's not ""sugar"" in the sense of being the stuff you put in your coffee, but it is sugar.";https://oauth.reddit.com/r/todayilearned/comments/y35b5d/til_sugar_does_not_cause_hyperactivity_in.json;2
Idea-Warm;"&gt;they only called it ""sugar"" because doctors noticed that diabetic blood was sweet.

Ah, yes, Doctor Acula.";https://oauth.reddit.com/r/todayilearned/comments/y35b5d/til_sugar_does_not_cause_hyperactivity_in.json;2
nomnomswedishfish;These doctors also insist garlic is bad for health;https://oauth.reddit.com/r/todayilearned/comments/y35b5d/til_sugar_does_not_cause_hyperactivity_in.json;3
Roland_Bodel_the_2nd;"Both the actual carb intake and the blood sugar levels are easy to measure though.  So we understand that relationship very well, and we can track ""glycemic index"" and insulin spikes, etc quite well.";https://oauth.reddit.com/r/todayilearned/comments/y35b5d/til_sugar_does_not_cause_hyperactivity_in.json;2
JudgeRealistic8341;Next you’ll tell me colds aren’t caused by cold weather! /s;https://oauth.reddit.com/r/todayilearned/comments/y35b5d/til_sugar_does_not_cause_hyperactivity_in.json;0
LincolnCassiusClay47;Of course not. You gotta have wet hair too!;https://oauth.reddit.com/r/todayilearned/comments/y35b5d/til_sugar_does_not_cause_hyperactivity_in.json;1
positiv2;Being bald is finally paying off;https://oauth.reddit.com/r/todayilearned/comments/y35b5d/til_sugar_does_not_cause_hyperactivity_in.json;2
NicksIdeaEngine;"You still might be at risk of a cold.

But it all depends on whether the hardwood floor matches the shutters ;)";https://oauth.reddit.com/r/todayilearned/comments/y35b5d/til_sugar_does_not_cause_hyperactivity_in.json;3
FlyingWhale44;If your scalp gets wet though you might get frost bite 😂;https://oauth.reddit.com/r/todayilearned/comments/y35b5d/til_sugar_does_not_cause_hyperactivity_in.json;3
VictorPedroNamura;Walking on cold floor with no sox;https://oauth.reddit.com/r/todayilearned/comments/y35b5d/til_sugar_does_not_cause_hyperactivity_in.json;2
TheSalsaShark;That's why I get David Ortiz to carry me across my cold floors.;https://oauth.reddit.com/r/todayilearned/comments/y35b5d/til_sugar_does_not_cause_hyperactivity_in.json;3
createsstuff;No no! It's wet feet! Mustn't leave  them to sit with the wet near the skin my dear Maturin! Towel drying really just isn't the same, they must have time to dry by the fire.;https://oauth.reddit.com/r/todayilearned/comments/y35b5d/til_sugar_does_not_cause_hyperactivity_in.json;2
BaconIsntThatGood;"Maybe this is a *myth* too but...

I always thought that being cold won't make you sick, but being cold does stress your immune system so it's more likely something that would have normally been repelled can get through?";https://oauth.reddit.com/r/todayilearned/comments/y35b5d/til_sugar_does_not_cause_hyperactivity_in.json;1
Raptorfeet;That, and also when the weather is cold, more people gather together indoors, making the colds spread easier.;https://oauth.reddit.com/r/todayilearned/comments/y35b5d/til_sugar_does_not_cause_hyperactivity_in.json;2
slaggernaut;And people gather near the sugar snacks. It's all coming together. I know it sounds sarcastic but its not;https://oauth.reddit.com/r/todayilearned/comments/y35b5d/til_sugar_does_not_cause_hyperactivity_in.json;3
SoundscapeSyndicate;And viruses survive in the environment longer in cooler, wetter conditions.;https://oauth.reddit.com/r/todayilearned/comments/y35b5d/til_sugar_does_not_cause_hyperactivity_in.json;3
Hugh_Maneiror;Some do, but others prefer high absolute humidity which is only possible at higher temperatures.;https://oauth.reddit.com/r/todayilearned/comments/y35b5d/til_sugar_does_not_cause_hyperactivity_in.json;4
frogvscrab;"It is two pronged: respiratory viruses spread easier in dry air, and people congregate indoors more. 

These are relatively small factors for individual transmission, but on a community-wide scale they are enough to push the R0 over 1, which results in exponential growth of the virus over time.";https://oauth.reddit.com/r/todayilearned/comments/y35b5d/til_sugar_does_not_cause_hyperactivity_in.json;2
MalevolentRhinoceros;"Yep, this is a lot like ""stress doesn't cause ulcers, a specific bacteria does!""

Most people carry that bacteria just fine without any symptoms, it's the effects of stress that cause it to be a problem.";https://oauth.reddit.com/r/todayilearned/comments/y35b5d/til_sugar_does_not_cause_hyperactivity_in.json;2
Fatalchemist;"But it's important to know the difference.

For example, if it's a combination of stressed immune system and people crowding together and such that makes winter great for the cold, people will avoid going outside. And they will... Gather inside where its warm, perhaps with other people. And thus indirectly doing to better contract and spread the virus while trying to avoid it.

Technically the cold weather made everything come together, but the temperature isn't what created the virus. So acknowledge the part the cold weather plays for overall patterns and predictions and such, but knowing the specifics really helps as well.";https://oauth.reddit.com/r/todayilearned/comments/y35b5d/til_sugar_does_not_cause_hyperactivity_in.json;3
murgatroid1;In Australia we have two cold seasons because we also gather inside in the middle of summer when it's too hot to be out. The winter cold season is still worse though.;https://oauth.reddit.com/r/todayilearned/comments/y35b5d/til_sugar_does_not_cause_hyperactivity_in.json;4
Presently_Absent;"I saw a BBC show try this - they gave vegetables to kids at a party with a hyperactive clown, and sugar to kids at a party with a boring entertainer. 

Every parent whose kid was at the clown party said their kid was wired for hours afterwards and swore they must have had the sugar... But nope, it's just that the energy level has everything to do with stimulation and nothing to do with sugar content";https://oauth.reddit.com/r/todayilearned/comments/y35b5d/til_sugar_does_not_cause_hyperactivity_in.json;0
raltoid;"The weirdest part is how even in basic studies where children where given colored water with sugar and without, then observed by their own parents. 

A lot of the parents **INSIST** that their kid got hyperactive from sugar, no matter what the facts where.

---

You can see it in this thread even, tons of people who don't believe it and jokingly brush it off.";https://oauth.reddit.com/r/todayilearned/comments/y35b5d/til_sugar_does_not_cause_hyperactivity_in.json;0
Grizzleyt;"It's because they read the study as saying, ""that thing you saw definitely didn't happen,"" which isn't necessarily true. As others have pointed out, things like being given a special treat, being in exciting social contexts like birthday parties, and the simple matter of nourishment=energy (especially when hungry / low blood sugar) means that kids could definitely be more active after the consumption of sugar.

The claim being refuted is that ""sugar causes hyperactivity"" which is specific about the root cause, the hypothesized resultant behavior, and possibly the mechanism (consumption of sugar as opposed to, say, the mental pathway of knowing you're getting a sugary food and thus being excited). 

So both can be ""true"" — sugar doesn't cause hyperactivity, and sugary treats are often associated with excited, energetic children. People disagreeing are probably insisting on the latter statement that reflects their lived experience more than the former in a technical, scientific sense.";https://oauth.reddit.com/r/todayilearned/comments/y35b5d/til_sugar_does_not_cause_hyperactivity_in.json;1
k_albasi;"Except they're referring to studies where the only difference between control groups was the parents' belief that their child received sugar.

One group of parents was told their children were receiving sugar and the other group of parents were told their children were receiving an aspartame placebo but in fact all the children received aspartame.

Every child in the experiment got the same no-sugar sweet tasting treat, but it was the parents who believed their children were getting sugar who rated their children as significantly more hyperactive.

So it's also entirely possible that the lived experience of parents seeing hyperactivity in their children is in part a result of expecting sugar to cause hyperactivity than any difference in behavior.";https://oauth.reddit.com/r/todayilearned/comments/y35b5d/til_sugar_does_not_cause_hyperactivity_in.json;2
moeburn;Yeah that wasn't a study on whether or not sugar affects children, that was a study on whether parents can be tricked into thinking green water contained sugar and see hyperactivity where there is none.;https://oauth.reddit.com/r/todayilearned/comments/y35b5d/til_sugar_does_not_cause_hyperactivity_in.json;3
Efficient-Library792;Yup;https://oauth.reddit.com/r/todayilearned/comments/y35b5d/til_sugar_does_not_cause_hyperactivity_in.json;4
ScrubbyFlubbus;"This thread is insane.

90% of the comments are ""As a parent I know better than science.""

All the people starting sentences with ""I don't need studies to tell me..."" are exactly the reason we need studies. Confirmation bias makes human intuition shit for a lot of things.

Edit: If your reply to this is ""So you're saying scientists are never wrong?"" then you are the poster child for a straw man fallacy.";https://oauth.reddit.com/r/todayilearned/comments/y35b5d/til_sugar_does_not_cause_hyperactivity_in.json;1
WritingTheRongs;really? all the top comments seem to say the opposite but maybe it took a few hours. As a parent I can tell you sugar has no observable effect on my kids. they love sugar. candy, cake ice cream, soda. I don't let them have it whenever but when i do they continue to act the same as always. that does include being screaming little shits sometimes but that's the same regardless of what they eat.;https://oauth.reddit.com/r/todayilearned/comments/y35b5d/til_sugar_does_not_cause_hyperactivity_in.json;2
ScrubbyFlubbus;"Yeah I didn't realize how quickly a TIL post gets comments. It went from like 200 to 900 in an hour.

If you sort them by Oldest then almost all of the top comments are people disagreeing with it due to anecdotes.";https://oauth.reddit.com/r/todayilearned/comments/y35b5d/til_sugar_does_not_cause_hyperactivity_in.json;3
MarieMarion;"As a French parent, this thread is even more insane.  
The sugar myth has never been a thing in France, and all those people in here are spouting nonsense that, to us, are on par with the tooth fairy and Santa. It's weird.";https://oauth.reddit.com/r/todayilearned/comments/y35b5d/til_sugar_does_not_cause_hyperactivity_in.json;2
willpowerpt;If anything, kids just get excited when getting candy, it’s not the sugar working then up, it’s the idea of it.;https://oauth.reddit.com/r/todayilearned/comments/y35b5d/til_sugar_does_not_cause_hyperactivity_in.json;0
ForensicPathology;"And then parents dismiss it as ""because of the sugar"" so the kids have an excuse to run wild which in turn reinforces the misconception.";https://oauth.reddit.com/r/todayilearned/comments/y35b5d/til_sugar_does_not_cause_hyperactivity_in.json;1
stygyan;"Sugar does not cause hyperactivity in children.

The fact that children tend to ingest more sugar in social situations like parties do.";https://oauth.reddit.com/r/todayilearned/comments/y35b5d/til_sugar_does_not_cause_hyperactivity_in.json;0
playblu;"Exactly. ""My kid ate some cake and now he's hyper! It just happened to be around 20 of his friends at Mechanical Rat Pizza &amp; Child Casino, but it was the sugar that did it""";https://oauth.reddit.com/r/todayilearned/comments/y35b5d/til_sugar_does_not_cause_hyperactivity_in.json;1
ajshn;"I will now only ever refer to Chuck E Cheese as Mechanical Rat Pizza &amp; Child Casino.";https://oauth.reddit.com/r/todayilearned/comments/y35b5d/til_sugar_does_not_cause_hyperactivity_in.json;2
UzumakiYoku;Excuse me it’s Chuck E Cheese, the E stands for Entertainment;https://oauth.reddit.com/r/todayilearned/comments/y35b5d/til_sugar_does_not_cause_hyperactivity_in.json;3
AtticMuse;Charles Entertainment Cheese 🐭;https://oauth.reddit.com/r/todayilearned/comments/y35b5d/til_sugar_does_not_cause_hyperactivity_in.json;4
ajshn;I will correct myself.;https://oauth.reddit.com/r/todayilearned/comments/y35b5d/til_sugar_does_not_cause_hyperactivity_in.json;4
anabolic_cow;But not only that, sugar triggers release of dopamine, which in turn makes people feel good, which in turn will put them in a good mood and make them more talkative or energetic in general.;https://oauth.reddit.com/r/todayilearned/comments/y35b5d/til_sugar_does_not_cause_hyperactivity_in.json;1
Axe-of-Kindness;In this thread: Fuck loads of cognitive dissonance;https://oauth.reddit.com/r/todayilearned/comments/y35b5d/til_sugar_does_not_cause_hyperactivity_in.json;0
Next_Boysenberry1414;"My guess is kids become hyperactive because they are happy to eat a treat.

Studies have may have used placebos which kids thought to be sugar and got happy.";https://oauth.reddit.com/r/todayilearned/comments/y35b5d/til_sugar_does_not_cause_hyperactivity_in.json;0
KommieKon;In the TV show Naked and Afraid the contestants expectedly eat very little most days they’re in the wild, the few times the people actually get a kill and cook it, they often describe being high from the meal. It’s all endorphins. The brain says “YES! Here’s some dope, now get me more of whatever you just ate!”;https://oauth.reddit.com/r/todayilearned/comments/y35b5d/til_sugar_does_not_cause_hyperactivity_in.json;1
officerbigpenis;Doesn’t help that every kid in the entire US for the last 50 years has been told that sugar makes them hyper.;https://oauth.reddit.com/r/todayilearned/comments/y35b5d/til_sugar_does_not_cause_hyperactivity_in.json;1
SoundscapeSyndicate;Also the parents. Studies have shown that the parents who believe their children get hyper tend to hover and micromanage their children a lot more, which is much more likely to cause neurotic behaviour.;https://oauth.reddit.com/r/todayilearned/comments/y35b5d/til_sugar_does_not_cause_hyperactivity_in.json;2
Vovicon;"Thank you.

This is not a myth that exists in my country and kids don't lose their mind after being given sweets because parents don't expect then to.";https://oauth.reddit.com/r/todayilearned/comments/y35b5d/til_sugar_does_not_cause_hyperactivity_in.json;2
Farseli;"It also has to do with how the parents are judging their child's behavior.

Children given sugar-free treats while parents informed the child was given sugar were considered by their parents more hyper and unruly.";https://oauth.reddit.com/r/todayilearned/comments/y35b5d/til_sugar_does_not_cause_hyperactivity_in.json;1
DocPeacock;Bingo. Endorphins/dopamine plus sudden increase in available energy = kids running around;https://oauth.reddit.com/r/todayilearned/comments/y35b5d/til_sugar_does_not_cause_hyperactivity_in.json;1
Strongdar;They even placeboed the parents in some studies, and the parents insisted their kids were hyper after eating the fake sugar.;https://oauth.reddit.com/r/todayilearned/comments/y35b5d/til_sugar_does_not_cause_hyperactivity_in.json;1
herberstank;Totally.  Special treat = special situation = dopamine;https://oauth.reddit.com/r/todayilearned/comments/y35b5d/til_sugar_does_not_cause_hyperactivity_in.json;1
southpaw85;So you’re telling me when I’m tired and I eat something sweet and it gives me energy that’s just my brain lying to me?;https://oauth.reddit.com/r/todayilearned/comments/y35b5d/til_sugar_does_not_cause_hyperactivity_in.json;0
unecroquemadame;I mean sugar is fuel for your body;https://oauth.reddit.com/r/todayilearned/comments/y35b5d/til_sugar_does_not_cause_hyperactivity_in.json;1
Pallets_Of_Cash;The mitochondria is the powerhouse of the cell.;https://oauth.reddit.com/r/todayilearned/comments/y35b5d/til_sugar_does_not_cause_hyperactivity_in.json;2
DonutCola;Lmao it’s not “hyperactivity” it’s just the opposite of “hypoactivity”;https://oauth.reddit.com/r/todayilearned/comments/y35b5d/til_sugar_does_not_cause_hyperactivity_in.json;1
ajandl;"Feeling tired is also a symptom of low blood sugar. If that happens to you often, you may want to eat more frequently or speak with a doctor.

I know diabetics who have discovered their condition due to the symptoms you describe.";https://oauth.reddit.com/r/todayilearned/comments/y35b5d/til_sugar_does_not_cause_hyperactivity_in.json;1
Ameisen;Feeling tired is also a symptom of _unsteady_ blood sugar. Spikes or drops can have a hard impact.;https://oauth.reddit.com/r/todayilearned/comments/y35b5d/til_sugar_does_not_cause_hyperactivity_in.json;2
LangyMD;Feeling tired is also a symptom of being awake for too long or too short of a time.;https://oauth.reddit.com/r/todayilearned/comments/y35b5d/til_sugar_does_not_cause_hyperactivity_in.json;3
MindxFreak;Feeling tired is also a symptom of *existing*.;https://oauth.reddit.com/r/todayilearned/comments/y35b5d/til_sugar_does_not_cause_hyperactivity_in.json;4
Idea-Warm;Feeling tired is also a strong sign that you may, in fact, be a wheel.;https://oauth.reddit.com/r/todayilearned/comments/y35b5d/til_sugar_does_not_cause_hyperactivity_in.json;5
Keanman;Were they diabetic or hypoglycemic? Diabetics are almost always diagnosed with a high BG due to being untreated.;https://oauth.reddit.com/r/todayilearned/comments/y35b5d/til_sugar_does_not_cause_hyperactivity_in.json;2
rich1051414;"It's either placebo, breaking boredom by eating delicious food that stimulates the brain, or your blood sugar was low and the sugar fixed that. 

Kids get excited by being given a treat, the sugar doesn't actually matter, that's just what makes the treat delicious.";https://oauth.reddit.com/r/todayilearned/comments/y35b5d/til_sugar_does_not_cause_hyperactivity_in.json;1
Malphos101;"The real TIL is how many redditors ""know"" facts and refuse to accept alternative explanations when confronted with actual scientific evidence.

Also kind of scary how many comments talk about how ""Coke/MountainDew/Dr.Pepper"" are sugary and their kids get hyper when drinking them....as if they have no idea what caffeine is or does to children...";https://oauth.reddit.com/r/todayilearned/comments/y35b5d/til_sugar_does_not_cause_hyperactivity_in.json;0
