skybluemango;The woods have always been listening…!;3;0
A_Talking_Shoe;"Man, imagine being the parents whose child was taken away. 

You are just minding your own business and some strangers claim that your child is theirs. They take you to court and the court sides with them. Then your child is taken away.";https://oauth.reddit.com/r/todayilearned/comments/y2yfwj/til_in_1912_4_yrold_bobby_dunbar_disappeared_was.json;0
GotMoFans;"Let me introduce you to Georgia Tann who stole babies and allowed people to buy them through an adoption process. Including wrestler Ric Flair.

https://www.wbur.org/onpoint/2019/10/22/lisa-wingate-before-and-after-orphans-tennessee-children";https://oauth.reddit.com/r/todayilearned/comments/y2yfwj/til_in_1912_4_yrold_bobby_dunbar_disappeared_was.json;1
ACaffeinatedWandress;I remember reading an article in China about countryside doctors who would tell parents that they miscarried babies (usually sons), then sell the perfectly fine babies to rich families in the city.;https://oauth.reddit.com/r/todayilearned/comments/y2yfwj/til_in_1912_4_yrold_bobby_dunbar_disappeared_was.json;2
want-to-say-this;"So many fears in China around kids disappearing. 

I am white and had a mixed Chinese baby born in a Chinese hospital. My in-laws have money and we were super vigilant. My son had at least me in the room at all times after being born. There was someone from our group awake with eye contact on the child at all times. And he would have been super identifiable as the white child in the hospital of all Chinese people. 

My FIL took me aside at a wedding 💒 n China once to tell me that under no circumstance do I believe what anyone says regarding watching the kids. Super serious staring me in the eyes. He said me my wife or him and my MIL should be the only one to hold my son and if anyone asks to hold my son who was a baby to run away.  


A few hours later before dinner. The maid told me she was told by him to take my son before dinner. And I was to go talk to my FIL. I remembered what he said and was like I’ll bring my son for the pictures opportunity. She kept insisting it was ok and that he told her to do it. I walked away with my son in my arms, and asked my FIL if he said that and he said no. I couldn’t sleep that night I had her fired and we got a new maid. I still think about it all the time. Just the thought of him being somewhere like confused and wondering why I’m not there to help just makes my heart stop. 

Currently in the USA kids are safe and sound happy healthy and hilarious and I hug them super tight every chance I can.";https://oauth.reddit.com/r/todayilearned/comments/y2yfwj/til_in_1912_4_yrold_bobby_dunbar_disappeared_was.json;3
apples_vs_oranges;Thanks for the nightmare fuel;https://oauth.reddit.com/r/todayilearned/comments/y2yfwj/til_in_1912_4_yrold_bobby_dunbar_disappeared_was.json;4
vagina_voodoo;Indeed! I’m a brand new mom (through adoption) to 2 non-verbal toddlers and that was like a gut punch. Holy crap.;https://oauth.reddit.com/r/todayilearned/comments/y2yfwj/til_in_1912_4_yrold_bobby_dunbar_disappeared_was.json;5
soggyballsack;Your telling me. I am full Mexican. TO the point that people even ask me if I speak English. When I was married we adopted a little girl, fully white. Blonde hair, colored eyes. When I divorced I got all the kids, my trips to Mexico were always a headache since they would see me with her and I always had cops interrogate me. I had to carry around personal paperwork that someone shouldn't carry. It's hard enough as a father to be alone with a little girl but 2 very distinct races are very very not good to explain.;https://oauth.reddit.com/r/todayilearned/comments/y2yfwj/til_in_1912_4_yrold_bobby_dunbar_disappeared_was.json;6
trapezoidalfractal;My mom had the opposite problem when I was a baby. I’m very brown and she’s white, they didn’t want to let her leave Mexico with me.;https://oauth.reddit.com/r/todayilearned/comments/y2yfwj/til_in_1912_4_yrold_bobby_dunbar_disappeared_was.json;7
aliie_627;"Did your mom ever get random people asking if you were her son? Especially in front of you by people barely more than strangers? If so did that ever bother you or your mom?

 I used to occasionally get that with my son, more rarely now that he's in middle school but it recently happened, so ive been wondering about it again and if that happens with other families,how they feel and react.";https://oauth.reddit.com/r/todayilearned/comments/y2yfwj/til_in_1912_4_yrold_bobby_dunbar_disappeared_was.json;8
1200____1200;"I coached my (half white, half S. Asian) son's hockey team and had a kid who was on the team for two years, not realize I was his dad lol.

Also get a lot of ""and, is this your father?"" questions when we check in at doctor appointments.

Had one receptionist do the ""oh he looks young, like maybe an older brother"" because she was embarrassed a bit maybe. This is when my son was 17 btw, and I don't look like I am likely to have a 17 yo brother...

I've never been challenged or had a rude encounter though";https://oauth.reddit.com/r/todayilearned/comments/y2yfwj/til_in_1912_4_yrold_bobby_dunbar_disappeared_was.json;9
MANDALORIAN_WHISKEY;Exact same experience. I'm darker than my mom, so when she and my dad traveled to Mexico with me as a baby, they almost didn't let her back into the US. Apparently she had my birth certificate, though, and that's what got her through. Funny, though, because my dad is pretty dark, so you'd think they would realize that he was the father. Guess not.;https://oauth.reddit.com/r/todayilearned/comments/y2yfwj/til_in_1912_4_yrold_bobby_dunbar_disappeared_was.json;8
PainTitan;If I have kids I'm just not travelling with them. What the fuck has the world come to.;https://oauth.reddit.com/r/todayilearned/comments/y2yfwj/til_in_1912_4_yrold_bobby_dunbar_disappeared_was.json;8
AT-ST;"It is especially hard when the race of the father is not white.  I'm white and periodically take my black friend's daughter with me and my son to the park.  I never get questioned.

Now when that black friend takes my son he sometimes has issues.  3 times he has been approached by cops and questioned.  Two of the times he said the cops were cool about it. They had received a call aboit a suspicious black male so they were just doing due diligence.  Asked him about the situation and asked my son if he knew my friend and if he felt safe.  Satisfied, they apologized and left.

That third time lead to me having to leave work to go to the park and stop my friend from getting arrested.  The cop didn't talk to my friend first.  He approached my son and asked him if that was his dad.  Of course, my 3 year old said no.  So the cop detained my friend and questioned him.  Luckily my friend thought to call me a few minutes before being put into handcuffs.

The irony, the cop never questioned if i was the boys dad.  I could have just been a white guy who was in on the kidnapping.";https://oauth.reddit.com/r/todayilearned/comments/y2yfwj/til_in_1912_4_yrold_bobby_dunbar_disappeared_was.json;7
PeterJamesUK;My step daughter is black, I'm very not black. The struggle is real;https://oauth.reddit.com/r/todayilearned/comments/y2yfwj/til_in_1912_4_yrold_bobby_dunbar_disappeared_was.json;7
koolaidface;"I’m white and my ex-wife is quite brown and Brasilian. Our daughter, now 17, is completely white, even more pale than I am, and looks almost nothing like her mom. They have issues every time they visit family in Brasil. 

When she was younger, strangers on two occasions came up to her in stores and asked if she needed help. With her mom right next to her. I was and still am furious about these incidents.";https://oauth.reddit.com/r/todayilearned/comments/y2yfwj/til_in_1912_4_yrold_bobby_dunbar_disappeared_was.json;7
Rapunzel10;My dad is part Native American and looks it. I was a blonde haired, blue eyed little girl. There were several points where people accused him of kidnapping me while we were out someplace. If people bothered to look they would have noticed we have the same blue eyes and very similar facial features, but many people couldn't get past the different skin and hair color and harassed him over it. One lady even picked me up and tried to walk off with me despite my dad's protests. He also started carrying around paperwork that proved I was his kid. Meanwhile I looked nothing like my white mom but no one ever bothered her about it;https://oauth.reddit.com/r/todayilearned/comments/y2yfwj/til_in_1912_4_yrold_bobby_dunbar_disappeared_was.json;7
1200____1200;"How is that people's go-to rather than it being a mixed-raced or step-family ffs.

Do people really believe that adults are kidnapping kids, specifically ones of a different race, and then just out about doing normal family things?";https://oauth.reddit.com/r/todayilearned/comments/y2yfwj/til_in_1912_4_yrold_bobby_dunbar_disappeared_was.json;8
Rapunzel10;"To be fair we faced the most problems around bathrooms. My dad would wait outside the bathroom while I went and then would often grab my hand or pick me up when I came out since I had a habit of wandering off. Ironically his efforts to keep me from getting kidnapped made it look more like he was kidnapping me. He started making a habit of addressing me by name and that seemed to help

Though once a lady called the police on him while he was grocery shopping with me in the cart, not really sure why she thought a kidnapper would take their victim to pick up eggs and milk. She was just crazy. Unfortunately there's lots of crazy or unreasonable people in this world";https://oauth.reddit.com/r/todayilearned/comments/y2yfwj/til_in_1912_4_yrold_bobby_dunbar_disappeared_was.json;9
Lazy-Garlic-5533;"So super fun 19th century story. A Mexican-American community in the Southwest made an agreement to take in some needy Irish Catholic orphans. All was well until the neighboring Anglo community saw these little white children in the Mexican town, started a stink, and ultimately stole the children to raise as Protestants.

When people ask about colonialism, racism, and genocide, that right there.";https://oauth.reddit.com/r/todayilearned/comments/y2yfwj/til_in_1912_4_yrold_bobby_dunbar_disappeared_was.json;7
Shelala85;"It looks like it was in 1904.

[""The Great Arizona Orphan Abduction"" by Linda Gordon](https://www.salon.com/1999/12/13/gordon_3/)";https://oauth.reddit.com/r/todayilearned/comments/y2yfwj/til_in_1912_4_yrold_bobby_dunbar_disappeared_was.json;8
DarkLasombra;The ironic part is that the Irish were not even considered white at this time. They were looked upon as inferior.;https://oauth.reddit.com/r/todayilearned/comments/y2yfwj/til_in_1912_4_yrold_bobby_dunbar_disappeared_was.json;8
LeagueOfLegendsAcc;I'm willing to bet people considered them non white only *after* finding out they were Irish.;https://oauth.reddit.com/r/todayilearned/comments/y2yfwj/til_in_1912_4_yrold_bobby_dunbar_disappeared_was.json;9
Idiot_Savant_Tinker;When my daughter was born (in the US) the security measures both bothered me and reassured me. She had a little ankle monitor that would make a piercing sound if it was removed, which would also lock the doors in the area and trigger an alarm in the security office. If you got too close to certain doors, there would be an alarm and the door would lock. There was another device on her other leg that I think tracked her position in the hospital, and a device that reminded me of the little doodad they put in clothing or expensive, easily stolen items in a store that make an alarm when you try to walk out without deactivating it.;https://oauth.reddit.com/r/todayilearned/comments/y2yfwj/til_in_1912_4_yrold_bobby_dunbar_disappeared_was.json;4
XchrisZ;"I install those systems. Some of them can have the mom given tag and only mom and baby can take the baby off the floor/area.

We can also have them tie into IP camera streams so when the alarms go off security gets a visual of exactly what is going on.

There used to be one system that had a tag that attached to the umbilical cord clip.";https://oauth.reddit.com/r/todayilearned/comments/y2yfwj/til_in_1912_4_yrold_bobby_dunbar_disappeared_was.json;5
BrownSugarSandwich;So it's like 2FA for babies?;https://oauth.reddit.com/r/todayilearned/comments/y2yfwj/til_in_1912_4_yrold_bobby_dunbar_disappeared_was.json;6
greengoblin343;More like geofencing;https://oauth.reddit.com/r/todayilearned/comments/y2yfwj/til_in_1912_4_yrold_bobby_dunbar_disappeared_was.json;7
klipseracer;Kinda? It's more like an apple airtag than 2fa.;https://oauth.reddit.com/r/todayilearned/comments/y2yfwj/til_in_1912_4_yrold_bobby_dunbar_disappeared_was.json;7
Gwingle;Well, the mom has the other tag and no other authentication means, so technically it's 1FA with other, non-authentication based security;https://oauth.reddit.com/r/todayilearned/comments/y2yfwj/til_in_1912_4_yrold_bobby_dunbar_disappeared_was.json;7
PerceptiveAxion;I remember my first kid 20 years ago at a major downtown city hospital had baby low jack (basically an anklet you couldn’t remove) and some type of sensor on his umbilical cord. The doors would force shut and the elevators turned off if you tried to leave the hallway with the baby. There was armed security at the door just to get upstairs to the baby place and everyone had to have their state ID scanned for entry.;https://oauth.reddit.com/r/todayilearned/comments/y2yfwj/til_in_1912_4_yrold_bobby_dunbar_disappeared_was.json;6
ChasingReignbows;I like the idea of a baby club with bouncers checking ids;https://oauth.reddit.com/r/todayilearned/comments/y2yfwj/til_in_1912_4_yrold_bobby_dunbar_disappeared_was.json;7
PerceptiveAxion;It’s called *The Baby Place.* It’s a connected but separate wing at an All Childrens, Johns Hopkins hospital that has its own main entrance, cafe, parking lot and stay rooms. I’ve had two kids delivered there over the years and always a very good experience for everyone involved. It’s definitely a baby club with bouncers.;https://oauth.reddit.com/r/todayilearned/comments/y2yfwj/til_in_1912_4_yrold_bobby_dunbar_disappeared_was.json;8
Fresh_Leadwater;My child had the umbilical clip device that locked doors and triggered alarms. We brought them back to the hospital 3 days later for a routine check, and everyone freaked out when doors locked and alarms went off. They told us we couldn't leave with that tag on. We let them know we were coming in, not out and we'd been home for days already. We were new parents and just figured the tag would be removed at this appointment. Nothing went off or locked when we originally left the hospital.;https://oauth.reddit.com/r/todayilearned/comments/y2yfwj/til_in_1912_4_yrold_bobby_dunbar_disappeared_was.json;7
FellowGeeks;QA fail;https://oauth.reddit.com/r/todayilearned/comments/y2yfwj/til_in_1912_4_yrold_bobby_dunbar_disappeared_was.json;8
TheDanielCF;"If someone pulls the fire alarm it disables the door/elevator locks right? What prevents someone from stealing a baby and pulling the fire alarm to get out of the building?

Shout-out to Rslash for putting this question in my brain.";https://oauth.reddit.com/r/todayilearned/comments/y2yfwj/til_in_1912_4_yrold_bobby_dunbar_disappeared_was.json;6
Random_name46;"I have dealt with kinda similar systems, I think. If they're anything alike then yeah the locks disable with the fire alarm. 

In my workplace we had policies and training that the lockdown areas were monitored by staff while locks were disabled. So there would be designated people at each exit stopping anyone who shouldn't leave and that's their entire job throughout the alarm. 

The fire systems also gave an accurate location and type of alarm, so pretty much everyone would converge on that specific area to assess and combat any issues. It would be difficult to slip out unnoticed. I suppose you could have a partner pull a station across the building but then you'd still run into the people watching the lockdown doors. 

There are always weaknesses but it's a balancing act of risk vs benefit. A fire emergency is a significantly higher risk than a successfully planned kidnapping so that's what takes priority.";https://oauth.reddit.com/r/todayilearned/comments/y2yfwj/til_in_1912_4_yrold_bobby_dunbar_disappeared_was.json;7
XchrisZ;2nd stage fire of alarm and key for local drop out requires a special permit and approval of the fire marshal but the hospitals always get the approval. Usually only where the babies and psychiatric patients are. I am located in Ontario Canada.;https://oauth.reddit.com/r/todayilearned/comments/y2yfwj/til_in_1912_4_yrold_bobby_dunbar_disappeared_was.json;7
brkh47;"There have been many instances around the world but I remember the famous one from South Africa, from a few years back. Baby girl was stolen from mom, in hospital, a few days after she born. Never found. Years later, when she was  a teenager, she was recognised by I think one of her siblings, who said she looked like them. It turns out she did not even live far from them.   


Court case then ensued. And the baby thief was jailed. However, the young girl only recognised her as her mom. She could not bond with her birth mom and I think blamed her biological parents for being the cause of her having her mom jailed. Sad, sad situation all around.";https://oauth.reddit.com/r/todayilearned/comments/y2yfwj/til_in_1912_4_yrold_bobby_dunbar_disappeared_was.json;5
ImaginaryList174;"She was recognized by her little sister. They had become friends in high school and everyone said they looked alike enough to be sisters. When the younger sister told her parents about this and showed them a picture, they became suspicious that it was their missing daughter. They engineered a meeting and were sure of it.. so they went to the cops. And yep, the mom was jailed... and the stolen daughter stayed with the father she had grown up with while visiting her mom in jail weekly. She wanted nothing to do with her ""real"" parents. Sad.";https://oauth.reddit.com/r/todayilearned/comments/y2yfwj/til_in_1912_4_yrold_bobby_dunbar_disappeared_was.json;6
mnem0syne;There was another case in southeastern US where girl was kidnapped and found as a teenager, but only knew her kidnapper as her mother, similar situation. I know she (understandably) had a hard time with the situation as first, but [this article](https://www.nytimes.com/2017/01/18/us/alexis-anigo-kamiyah-mobley-kidnapping.html) didn’t really get into it. I remember when she was first found and it was so tragic.;https://oauth.reddit.com/r/todayilearned/comments/y2yfwj/til_in_1912_4_yrold_bobby_dunbar_disappeared_was.json;6
Snuhmeh;Little babies all look so similar. They are unfortunately easy targets and desperate people will do almost anything to get one. The mothers that are dealing with losing a baby of their own and/or dealing with postpartum psychosis are the most dangerous.;https://oauth.reddit.com/r/todayilearned/comments/y2yfwj/til_in_1912_4_yrold_bobby_dunbar_disappeared_was.json;5
ZodTheBuilder;One of my biggest fears when my kids were born is that I would forget what they looked like and not be sure it was mine they brought into the room.  When you've only seen them a couple of times they could drop anybody's baby in front of you and you'd think it was yours.;https://oauth.reddit.com/r/todayilearned/comments/y2yfwj/til_in_1912_4_yrold_bobby_dunbar_disappeared_was.json;6
jikan-desu;That phenomenon actually evolutionary from long ago so if a baby was left behind and someone else found it they wouldn’t have any issue considering it to be their own baby and proceeding to take care of it.;https://oauth.reddit.com/r/todayilearned/comments/y2yfwj/til_in_1912_4_yrold_bobby_dunbar_disappeared_was.json;6
BlackWidow1414;Oh, the baby Lo-Jack, as we called it.;https://oauth.reddit.com/r/todayilearned/comments/y2yfwj/til_in_1912_4_yrold_bobby_dunbar_disappeared_was.json;5
ZantetsukenX;It's my time to shine! I was actually kidnapped from the hospital as a newborn baby in the late 80s. Someone dressed as a nurse came in and said it was time for some tests or something and then promptly left the building after I was handed over. Cops did a small car chase and caught her before they left the state lines.;https://oauth.reddit.com/r/todayilearned/comments/y2yfwj/til_in_1912_4_yrold_bobby_dunbar_disappeared_was.json;5
zvekl;Yeah. Shanghai and my sister was super paranoid about their kids. Why? Their personal lawyer they use for business had a son kidnapped.  Yeah sad freaky shit.;https://oauth.reddit.com/r/todayilearned/comments/y2yfwj/til_in_1912_4_yrold_bobby_dunbar_disappeared_was.json;4
ArizonaSpartan;"Had a similar convo with my in laws. And then when my oldest was about 1yr grandpa was out carrying him around for outside time, and 2 guys said they were cops and to give them the kid. He refused because they weren’t in uniform and couldn’t show badges and he kept moving towards a bank where he knew there would be an officer. They walked away. 2 days later the cops arrested those guys when they snatched a kid and ran into an indoor market, the security officers locked everyone in until the police arrived. The 2 guys were on TV that night, my FIL said that’s the guys who I encountered. He swore out a police statement the next day about what happened. 

And it can be so bad in China, when I was hospitalized for 3 days for internal bleeding my FIL was there around the clock with me until relieved by my wife. They were all scared someone would take my things or try to kidnap me. And this was in a major city.";https://oauth.reddit.com/r/todayilearned/comments/y2yfwj/til_in_1912_4_yrold_bobby_dunbar_disappeared_was.json;4
righttoabsurdity;Similar story here, my sister is adopted from China. When my parents went to go pick her up, they got a whole ton of speeches about not letting anybody hold the baby, touch the baby, etc. Pretty much exactly what you were told, if someone asks to hold the baby, no matter who they are, run. Scary;https://oauth.reddit.com/r/todayilearned/comments/y2yfwj/til_in_1912_4_yrold_bobby_dunbar_disappeared_was.json;4
neolologist;What are people doing with these babies? You couldn't pay me to take a baby.;https://oauth.reddit.com/r/todayilearned/comments/y2yfwj/til_in_1912_4_yrold_bobby_dunbar_disappeared_was.json;5
felix4746194;Selling them. And not always to parents, there is still slave labor, sex work, etc where they can get money for a child.;https://oauth.reddit.com/r/todayilearned/comments/y2yfwj/til_in_1912_4_yrold_bobby_dunbar_disappeared_was.json;6
neolologist;I guess I don't understand why you'd steal a baby to be a slave. So much trouble to raise and keep healthy till they can even be useful. At least kidnap a kid that's old enough to do your laundry.;https://oauth.reddit.com/r/todayilearned/comments/y2yfwj/til_in_1912_4_yrold_bobby_dunbar_disappeared_was.json;7
krilltucky;The older slaves are who raise the baby if the baby is for slavery and not the other horrifying options;https://oauth.reddit.com/r/todayilearned/comments/y2yfwj/til_in_1912_4_yrold_bobby_dunbar_disappeared_was.json;8
i_will_let_you_know;But then they would have something to go back to and are more likely to run away. If you steal a baby they've never known anything different.;https://oauth.reddit.com/r/todayilearned/comments/y2yfwj/til_in_1912_4_yrold_bobby_dunbar_disappeared_was.json;8
wanderingmagus;Sick people pay good money to use infants in ways too dark to even describe.;https://oauth.reddit.com/r/todayilearned/comments/y2yfwj/til_in_1912_4_yrold_bobby_dunbar_disappeared_was.json;8
ACaffeinatedWandress;That is terrifying that your maid (apparently) attempted that! I feel like you had two targets on your back. A. Had an infant, and B. Was a foreigner (which the locals tend to take as gospel means, ‘stupid and easily conned.’). Also, ‘half-white’ probably means ‘higher sale value’, and if you get the kid a province or two over, it won’t matter how easy it is to ID.;https://oauth.reddit.com/r/todayilearned/comments/y2yfwj/til_in_1912_4_yrold_bobby_dunbar_disappeared_was.json;4
YouKilledMyTeardrop;Plot twist. The FIL hated the maid and did speak to her after speaking to OP. Result - fired!;https://oauth.reddit.com/r/todayilearned/comments/y2yfwj/til_in_1912_4_yrold_bobby_dunbar_disappeared_was.json;5
FFX13NL;At first i thought it was a test from the FIL.;https://oauth.reddit.com/r/todayilearned/comments/y2yfwj/til_in_1912_4_yrold_bobby_dunbar_disappeared_was.json;6
whatwhatinthebutt456;This happened to me in Mexico when I was a baby. My family was at a restaurant and a young woman said I was cute and asked to hold me. My dad and my brother had to chase her down outside the restaurant.;https://oauth.reddit.com/r/todayilearned/comments/y2yfwj/til_in_1912_4_yrold_bobby_dunbar_disappeared_was.json;4
bad_at_hearthstone;This story reached deep inside me and twisted something. I am glad your boy has such attentive parents.;https://oauth.reddit.com/r/todayilearned/comments/y2yfwj/til_in_1912_4_yrold_bobby_dunbar_disappeared_was.json;4
Danhuangmao;I seem to remember child kidnapping and sale was weirdly common in Franco's Spain, with corrupt officials either taking part of taking kickbacks.;https://oauth.reddit.com/r/todayilearned/comments/y2yfwj/til_in_1912_4_yrold_bobby_dunbar_disappeared_was.json;3
Tiny_Dinky_Daffy_69;This also happened a lot on Argentina. The military would kidnap women, rape them, and then sold the babies.;https://oauth.reddit.com/r/todayilearned/comments/y2yfwj/til_in_1912_4_yrold_bobby_dunbar_disappeared_was.json;4
